titulo,resumen,autor,fecha,url,sentiment_score,sentiment
Aeropuertos de Perú destinarán US$780 millones hasta 2030 para mejora de pistas,"Las terminales aéreas de Perú es una concesión cofinanciada que, a pesar de ser una empresa privada, tiene sus proyectos como inversión pública",,2025-07-03,https://www.larepublica.co/globoeconomia/aeropuertos-de-peru-destinaran-us-780-millones-hasta-2030-para-mejora-de-pistas-4171518,0.0,neutral
Presidente Trump hablará con su homólogo Putin mientras busca una tregua en Ucrania,Las llamadas se producen tras la decisión del gobierno de pausar la transferencia de munición de artillería y defensas aéreas a Ucrania,,2025-07-03,https://www.larepublica.co/globoeconomia/presidente-trump-hablara-con-su-homologo-putin-mientras-busca-una-tregua-en-ucrania-4171511,0.0,neutral
Compañías fintech representan 10% de consumidores nuevos al crédito en Colombia,TranUnion realizó un estudio y dijo que los usuarios de estas compañías financieras suelen ser más jóvenes y con un mayor riesgo,,2025-07-03,https://www.larepublica.co/finanzas/consumidores-de-las-fintech-en-colombia-4171506,0.0,neutral
Mineral de hierro sube mientras China está frenando el exceso de capacidad industrial,Pekín quiere frenar la competencia de precios y el exceso de capacidad industrial indica que sus dirigentes buscan enfrentar las presiones deflacionistas,,2025-07-03,https://www.larepublica.co/globoeconomia/mineral-de-hierro-sube-mientras-china-esta-frenando-el-exceso-de-capacidad-industrial-4171502,0.0,neutral
Andi dijo que Unidad de Pago por Capitación debió crecer entre 10% y 16% en 2025,"Para el gremio, esta situación está llevando a una crisis en entidades del sector, que se han visto obligadas a cerrar servicios o a limitar la atención",,2025-07-03,https://www.larepublica.co/economia/andi-dijo-que-unidad-de-pago-por-capitacion-debio-crecer-entre-10-y-16-en-2025-4171496,-0.6249,negative
Perú decidió cerrar temporalmente sus fronteras a la pitahaya proveniente de Ecuadorr,"El territorio compra pitahaya ecuatoriana desde el 2022 y, para el 2023, se convirtió en el cuarto mercado internacional, después de Estados Unidos",,2025-07-03,https://www.larepublica.co/globoeconomia/peru-decidio-cerrar-temporalmente-sus-fronteras-a-la-pitahaya-proveniente-de-ecuador-4171488,0.0,neutral
Déficit fiscal acumulado hasta abril de 2025 fue el más alto desde la pandemia de covid-19,Aumento en el gasto público y leve caída de los ingresos fiscales frente a 2024 son las razones que explican el aumento en la brecha del erario,,2025-07-03,https://www.larepublica.co/economia/deficit-fiscal-acumulado-hasta-abril-de-2025-fue-el-mas-alto-desde-la-pandemia-4171449,0.0,neutral
Crecimiento del empleo en EE.UU. se acelera por la contratación en educación pública,"Las nóminas aumentaron en 147.000 el mes pasado, impulsadas por un aumento en el empleo en los gobiernos estatales y locales",,2025-07-03,https://www.larepublica.co/globoeconomia/crecimiento-del-empleo-en-ee-uu-se-acelera-por-la-contratacion-en-educacion-publica-4171430,0.0,neutral
Gobierno confía en que el nuevo sistema pensional entre en vigencia en dos meses,"El presidente de Colpensiones, Jaime Dussán, desmintió que no existieran recursos para cubrir el Pilar Solidario y dijo que eso le corresponde al Departamento de Prosperidad Social",,2025-07-03,https://www.larepublica.co/finanzas/reforma-pensional-2025-gobierno-confia-en-que-el-nuevo-sistema-pensional-entre-en-vigencia-en-dos-meses-4171373,-0.296,negative
Cervecera Heineken va a invertir US$10 millones en dos años en su fábrica de Valencia,,,2025-07-03,https://www.larepublica.co/globoeconomia/cervecera-heineken-va-a-invertir-us-10-millones-en-dos-anos-en-su-fabrica-de-valencia-4171423,0.0,neutral
¿Cómo los negocios pueden registrar una llave con el nuevo sistema de pagos Bre-B?,"Bancolombia explicó que, desde el 14 de julio de 2025, las personas o empresas podrán registrar o confirmar oficialmente sus llaves",,2025-07-03,https://www.larepublica.co/finanzas/como-los-negocios-pueden-abrir-una-llave-con-bre-b-4171414,0.0,neutral
"Por tercer mes, las ventas de vehículos ligeros en México disminuyó 5,9% durante junio","La comercialización “débil” de autos se ve reflejada por la caída de 12% de General Motors, que es la segunda marca con mayor venta en México",,2025-07-03,https://www.larepublica.co/globoeconomia/por-tercer-mes-las-ventas-de-vehiculos-ligeros-en-mexico-disminuyo-5-9-durante-junio-4171372,0.0,neutral
El dólar profundiza su caída y se negocia en promedio por debajo de $3.985,"El precio promedio de la tasa de cambio es el más bajo desde el pasado 11 de julio de 2024 cuando se marcó $3.979,91",,2025-07-03,https://www.larepublica.co/finanzas/precio-del-dolar-y-del-petroleo-hoy-3-de-julio-de-2025-4171296,0.0,neutral
"Ola de calor golpea a Europa con incendios, cierres escolares y evacuaciones masivas","En Francia, 84 de los 101 departamentos del país permanecieron bajo alerta naranja, el segundo nivel más alto de riesgo por calor",,2025-07-03,https://www.larepublica.co/globoeconomia/ola-de-calor-golpea-a-europa-con-incendios-cierres-escolares-y-evacuaciones-masivas-4171360,0.0,neutral
Distribuidores de combustibles líquidos necesitarán certificado para operar en departamentos,Este documento deberá ser expedido por el Ministerio de Justicia y enviado a la Dirección de Hidrocarburos del Ministerio de Minas y Energía,,2025-07-03,https://www.larepublica.co/economia/distribuidores-de-combustibles-liquidos-necesitaran-certificado-para-operar-4171357,0.0,neutral
"El gerente de Corabastos, Francisco Javier Salcedo, renunció por presión de la junta","Salcedo afirmó que parte de la decisión tomada por algunos miembros de la junta, fue por falta de confianza en algunos accionistas",,2025-07-03,https://www.larepublica.co/empresas/el-gerente-de-corabastos-francisco-javier-salcedo-renuncio-por-presion-de-la-junta-4171297,0.0,neutral
"EPM finaliza la gestión de servicios de acueducto, alcantarillado y aseo en Quibdó","Empresas Públicas de Quibdó será la compañía que asuma completamente la operación de los tres servicios, tras un empalme con la compañía antioqueña",,2025-07-03,https://www.larepublica.co/empresas/epm-finaliza-la-gestion-de-servicios-de-acueducto-alcantarillado-y-aseo-en-quibdo-4171298,0.0,neutral
Vaca Muerta despega impulsada por un experimento de libre mercado de Javier Milei,"Es un proyecto existencial para todos los involucrados, si Milei logra generar nueva riqueza petrolera, podría sacar al país del estancamiento económico",,2025-07-03,https://www.larepublica.co/globoeconomia/vaca-muerta-despega-impulsada-por-un-experimento-de-libre-mercado-de-javier-milei-4171292,0.0,neutral
"Desde 2002, un canciller tiene una media de duración de 27 meses en su cargo",Laura Sarabia renunció al ministerio de Relaciones Exteriores luego de estar cinco meses al frente de la cartera,,2025-07-03,https://www.larepublica.co/economia/desde-2002-un-canciller-tiene-una-media-de-duracion-de-27-meses-en-su-cargo-4171291,0.0,neutral
BlackRock está considerando vender su participación en gasoductos de Saudi Aramco,"La firma estadounidense evaluará otras opciones para el activo si las conversaciones no llegan a un acuerdo, según algunas de las fuentes",,2025-07-03,https://www.larepublica.co/globoeconomia/blackrock-esta-considerando-vender-su-participacion-en-gasoductos-de-saudi-aramco-4171282,-0.296,negative
Eliminación de subsidios al diésel llega a equivaler una tributaria para el Gobierno,"Para la Asociación Colombiana de Petróleo, el subsidio alcanza $8 billones; mientras que el Gobierno señaló que este supera $10 billones",,2025-07-03,https://www.larepublica.co/economia/la-eliminacion-de-los-subsidios-al-diesel-equivale-a-una-reforma-tributaria-4171277,0.0,neutral
"Petro discrepa de la postura política y climática de Macron, el francés le pidió respeto","Gustavo Petro criticó la ""superioridad"" de Esatdos Unidos y Europa, ante esto, el mandatario francés pidió que se trabajara más y se dieran menos lecciones",,2025-07-03,https://www.larepublica.co/economia/petro-discrepa-de-la-postura-politica-y-climatica-de-macron-el-frances-le-pidio-respeto-4171262,0.0,neutral
El oro cede sobre US$3.340 a la espera de los nuevos datos de empleo en Estados Unidos,"Se espera que el informe de nóminas no agrícolas, previsto para el jueves, muestre un aumento de 110.000 puestos de trabajo en junio",,2025-07-03,https://www.larepublica.co/finanzas/precio-del-oro-hoy-3-de-julio-de-2025-4171274,-0.296,negative
Un asesor de subastas de Citgo Petroleum recomienda una oferta de reserva de oro,,,2025-07-03,https://www.larepublica.co/globoeconomia/un-asesor-de-subastas-de-citgo-petroleum-recomienda-una-oferta-de-reserva-de-oro-4171270,0.0,neutral
Superintendencia de Sociedades confirmó proceso de liquidación para Marchen S.A.,"La Supersociedades tomó la decisión de apertura del proceso liquidatorio con el fin de ""proteger el patrimonio empresarial y salvaguardar el orden crediticio""",,2025-07-03,https://www.larepublica.co/empresas/superintendencia-de-sociedades-confirmo-proceso-de-liquidacion-para-marchen-s-a-4171243,0.0,neutral
"Un terremoto de magnitud preliminar de 5,5 sacudió partes del suroeste de Japón","El epicentro del seísmo se situaba frente a la costa de la cadena de islas de Tokara, en la prefectura de Kagoshima, a casi 1.200 kilómetros de Tokio",,2025-07-03,https://www.larepublica.co/globoeconomia/un-terremoto-de-magnitud-preliminar-de-5-5-sacudio-partes-del-suroeste-de-japon-4171258,0.0,neutral
Everfit solicitó la admisión al proceso de liquidación judicial ante la Supersociedades,"En la solicitud presentada, la compañía reportó un activo total por $37.777 millones y pasivos por $31.416 millones con corte al 31 de mayo",,2025-07-03,https://www.larepublica.co/empresas/everfit-solicito-la-admision-al-proceso-de-liquidacion-judicial-ante-la-supersociedades-4171242,0.0,neutral
"Francia multa a Shein con US$47,17 millones por unas prácticas comerciales engañosas","La agencia dijo que Infinite Style E-Commerce, que gestiona las ventas de la marca Shein, había engañado a los clientes sobre los descuentos",,2025-07-03,https://www.larepublica.co/globoeconomia/francia-multa-a-shein-con-us-47-17-millones-por-unas-practicas-comerciales-enganosas-4171249,0.0,neutral
Diogo Jota,"Diogo Jota, futbolista portugués del Liverpool y su hermano, fallecieron este jueves en un accidente de tránsito en España",,2025-07-03,https://www.larepublica.co/obituarios/fallecio-diogo-jota-futbolista-portugues-del-liverpool-4171245,0.0,neutral
Cámara se acerca a la aprobación del proyecto de ley de Trump tras noche de debate,"""Tenemos los votos"", declaró el presidente de la Cámara de Representantes, Mike Johnson, a la prensa poco después de las 3 de la madrugada del jueves",,2025-07-03,https://www.larepublica.co/globoeconomia/camara-se-acerca-a-la-aprobacion-del-proyecto-de-ley-de-trump-tras-noche-de-debate-4171238,0.0,neutral
“La planta de tratamiento Canoas se adjudicará en el primer semestre de 2026”,"Natasha Avendaño, gerente de Acueducto y Alcantarillado de Bogotá, habló del futuro del proyecto y el balance postracionamiento",,2025-07-03,https://www.larepublica.co/economia/entrevista-con-natasha-avendano-gerente-de-la-eaab-sobre-el-avance-del-proyecto-de-tratamiento-de-aguas-residuales-4171066,0.0,neutral
La universidad debe ser el laboratorio de paz que el país necesita,"La universidad no puede ser el reflejo del país, todo lo contrario, en momentos de crisis debe iluminar el camino de la sociedad",,2025-07-03,https://www.larepublica.co/analisis/jose-ismael-pena-reyes-3960471/la-universidad-debe-ser-el-laboratorio-de-paz-que-el-pais-necesita-4170822,-0.743,negative
Doña Nydia y la solidaridad,"Doña Nydia vivió en carne propia los rigores de la violencia en Colombia; su hija fue vilmente asesinada y hoy su nieto Miguel libra una lucha por la vida, que los colombianos sentimos como propia",,2025-07-03,https://www.larepublica.co/analisis/alfredo-sarmiento-narvaez-3420523/dona-nydia-y-la-solidaridad-4170839,0.0,neutral
Cambios en las Juntas Directivas en las 1.000 empresas más grandes de 2024,Llegadas a nuevos cargos y coyunturas políticas marcaron rumbo de alta gerencia de las 10 empresas que más facturaron en 2024,,2025-07-03,https://www.larepublica.co/especiales/las-mil-empresas-mas-grandes-de-2024/los-cambios-dentro-de-las-juntas-directivas-de-las-1-000-empresas-mas-grandes-de-2024-4170610,0.0,neutral
"Esenttia MB y Ecodiesel Colombia, las empresas que lideran el grupo de 401 a 500","Las organizaciones de este club registraron utilidades netas totales superiores a $4,7 billones, lo que representó una reducción de 36,2% frente a 2023",,2025-07-03,https://www.larepublica.co/especiales/las-mil-empresas-mas-grandes-de-2024/ranking-de-las-empresas-mas-grandes-de-colombia-2024-puestos-401-a-500-4170273,0.0,neutral
“El sector asegurador no se puede quedar atrás en la transición digital del mercado local”,"Angélica Ardila, directora ejecutiva de la asociación Insurtech Colombia, dijo que la adopción de seguros puede incidir en una mayor inclusión financiera",,2025-07-03,https://www.larepublica.co/finanzas/entrevista-con-angelica-ardila-directora-ejecutiva-de-insurtech-4171055,0.0,neutral
Las grandes empresas que ganaron terreno en el sector farmacéutico el año pasado,"La industria farmacéutica y química en Colombia es una pieza clave en la economía nacional. De hecho, este sector aportó 2,8% al PIB en 2024",,2025-07-03,https://www.larepublica.co/especiales/las-mil-empresas-mas-grandes-de-2024/las-empresas-mas-grandes-del-sector-farmaceutico-en-colombia-en-2024-4169687,0.0,neutral
Essa se mantuvo en 2024 como la empresa líder de la región oriental,"Marval ha venido mostrando una caída estrepitosa en los ingresos de los últimos años, la constructora aterrizó en el quinto puesto de Las Mil Más Grandes",,2025-07-03,https://www.larepublica.co/especiales/las-mil-empresas-mas-grandes-de-2024/las-empresas-mas-grandes-de-la-region-oriente-en-2024-4170682,0.34,positive
"Las empresas más grandes del Pacífico en 2024 sumaron $107,8 billones en ingresos","En la región Pacífico las cinco primeras empresas más vendedoras acumularon 1,9% del PIB Nacional, entre ellas lideran Celsia Colombia, Carvajal y Emcali",,2025-07-03,https://www.larepublica.co/especiales/las-mil-empresas-mas-grandes-de-2024/las-empresas-mas-grandes-del-pacifico-en-2024-sumaron-107-8-billones-en-ingresos-4170276,0.0,neutral
Fe,"Lo que en la vida realmente nos hace invencibles es la fe; solo la fe es capaz de lograr lo que muchos no son capaces de imaginar. El fútbol como la vida, sin fe, no son posibles, no son concebibles",,2025-07-03,https://www.larepublica.co/analisis/yamid-amat-serna-3948786/fe-4170834,-0.8481,negative
Las empresas más grandes del país invierten en herramientas de IA,Dentro de las optimizaciones que brindan las nuevas tecnologías están la implementación de modelos predictivos y la optimización de tiempo,,2025-07-03,https://www.larepublica.co/especiales/las-mil-empresas-mas-grandes-de-2024/las-empresas-mas-grandes-del-pais-invierten-en-herramientas-de-inteligencia-artificial-4170119,0.0,neutral
Las remesas crecen al mismo ritmo del petróleo y de la inversión extranjera directa,"El reporte más reciente del Banco de la República muestra que hasta mayo ingresaron US$5.323 millones, CASI 15% más  de lo registrado en el mismo periodo de 2024",,2025-07-03,https://www.larepublica.co/economia/las-remesas-crecen-al-mismo-ritmo-del-petroleo-y-la-inversion-extranjera-directa-4171087,0.0,neutral
"Reficar, Avianca y Promigas, las empresas que más pesan en las cuentas del Caribe","Entre estas compañías destacan gigantes de sectores estratégicos como refinación de petróleo, transporte aéreo y energía",,2025-07-03,https://www.larepublica.co/especiales/las-mil-empresas-mas-grandes-de-2024/las-empresas-mas-grandes-de-caribe-en-2024-4170264,0.0,neutral
Finanzas 24-7,El mundo ya se está moviendo hacia una economía 24/7. Sistemas como Pix en Brasil o UPI en India no solo modernizaron sus pagos: cambiaron la relación de los ciudadanos con el dinero,,2025-07-03,https://www.larepublica.co/analisis/jose-ignacio-lopez-2780651/finanzas-24-7-4170844,-0.296,negative
"Colsanitas, el Metro y Esenttia, líderes del bloque dos, desde la 101 a la empresa 200","El segundo bloque tuvo ingresos por $169 billones el año pasado, que representó un incremento de 4,2% frente a lo obtenido en 2023",,2025-07-03,https://www.larepublica.co/especiales/las-mil-empresas-mas-grandes-de-2024/las-empresas-mas-grandes-del-segundo-bloque-de-la-101-a-la-200-en-2024-4169842,0.0,neutral
“Esperamos exportar a diferentes países desde nuestra producción local en Siberia”,"Jorge Rohl, gerente de Unidad de Negocio de Congrupo, representante de marcas como Hershey’s y Flips, firmó un alianza con wakeUp, para agregar ofertas de comida saludable a su portafolio",,2025-07-03,https://www.larepublica.co/empresas/esperamos-exportar-a-diferentes-paises-desde-nuestra-produccion-en-siberia-dijo-jorge-rohl-gerente-de-congrupo-4170121,0.0,neutral
La casa de moda inspirada en Ecomoda,,,2025-07-03,https://www.larepublica.co/caja-fuerte/la-casa-de-moda-inspirada-en-ecomoda-4170940,0.0,neutral
Las Mil Empresas concentran 69% del PIB nominal,"Durante 2024, estas compañías reportaron ingresos consolidados por $1.183 billones y utilidades netas por más de $90 billones",,2025-07-03,https://www.larepublica.co/especiales/las-mil-empresas-mas-grandes-de-2024/las-mil-empresas-concentran-69-del-pib-nominal-4170631,0.0,neutral
"EPM, Enel, ISA, Claro y GEB son las empresas que lideran sector de servicios públicos","A causa de la coyuntura derivada del faltante en la producción de hidrocarburos, algunas de estas compañías han estado en el centro de la agenda mediática",,2025-07-03,https://www.larepublica.co/especiales/las-mil-empresas-mas-grandes-de-2024/las-empresas-mas-grandes-del-sector-de-servicios-publicos-en-2024-4170762,0.0,neutral
"La prisión Alcatraz en Florida, Estados Unidos tendrá capacidad para más de 5.000 personas","El complejo del sur de Florida, en el Aeropuerto de Entrenamiento y Transición Dade Collier, costará US$450 millones anuales",,2025-07-03,https://www.larepublica.co/globoeconomia/la-prision-en-florida-en-estados-unidos-va-a-tener-capacidad-para-mas-de-5-000-personas-4170984,0.0,neutral
"Ranking de Las Cien Empresas Más Grandes, lo lidera Ecopetrol y EPM","Las utilidades de las 1.000 compañías bajaron $9 billones, desde los $99 billones, hasta los $90 billones que reveló el superintedente Billy Escobar.",,2025-07-03,https://www.larepublica.co/especiales/las-mil-empresas-mas-grandes-de-2024/las-cien-empresas-mas-grandes-de-2024-4170492,0.0,neutral
Incauca y Holcim están en el club de los más de $940.405 millones,Del sector de construcción solamente Construcciones El Condor y Marval estuvieron en el listado del tercer centenar de las más grandes,,2025-07-03,https://www.larepublica.co/especiales/las-mil-empresas-mas-grandes-de-2024/el-listado-del-puesto-201-al-300-de-las-mil-empresas-mas-grandes-de-2024-4170431,0.0,neutral
Cláusula de escape de la regla fiscal: razones de la activación,La activación de la cláusula de escape fue con el fin de evitar que la economía pierda su senda de recuperación y crecimiento,,2025-07-03,https://www.larepublica.co/analisis/jorge-coronel-lopez-4063283/clausula-de-escape-de-la-regla-fiscal-razones-de-la-activacion-4170828,0.1779,positive
Admirar a los que eligen educar,"Los profesores son héroes que escogen hacer educando, merecen nuestro reconocimiento, agradecimiento y recompensa",,2025-07-03,https://www.larepublica.co/analisis/ugo-posada-4038512/admirar-a-los-que-eligen-educar-4170833,0.0,neutral
Fin del idilio de Trump y Musk deja enseñanzas,"Confundir el “quehacer empresarial” con el “hacer política” suele terminar con grandes derrotados para la sociedad: la confianza, los empleos y las instituciones de un país",,2025-07-03,https://www.larepublica.co/opinion/editorial/fin-del-idilio-de-trump-y-musk-deja-ensenanzas-4170117,0.0,neutral
Colombia tiene una cobertura 4G en las zonas rurales 10% más alta que en la región,"En gobierno digital, el reporte del CAF situó a Colombia en el segundo lugar regional, con 82% de servicios públicos disponibles en línea. Uruguay es el líder",,2025-07-03,https://www.larepublica.co/especiales/las-mil-empresas-mas-grandes-de-2024/como-esta-colombia-en-infraestructura-tecnologica-frente-a-otros-paises-de-la-region-4170092,0.0,neutral
Casi $30 billones sumó el último centenar de las Mil Empresas Más Grandes en 2024,"Para formar parte del club de las empresas que se ubicaron entre los puestos 901 y 1.000, una compañía tuvo que vender más de $282.412 millones durante el año pasado",,2025-07-03,https://www.larepublica.co/especiales/las-mil-empresas-mas-grandes-de-2024/las-empresas-mas-grandes-del-puesto-901-al-1000-en-2024-4170401,0.0,neutral
"Inversiones TQ, Marval y Cartagena II lideraron el grupo de las 701-800 durante 2024","Empresas como Inversiones TQ SAS, Marval Holding, Cartagena II SA, Carbe SAS, Rymel Ingeniería Eléctrica S.A.S. y Cartonera Nacional SA tuvieron las cifras más altas del informe",,2025-07-03,https://www.larepublica.co/especiales/las-mil-empresas-mas-grandes-de-2024/ranking-de-las-empresas-mas-grandes-de-colombia-2024-puestos-701-a-800-4169810,0.0,neutral
El peso colombiano continua siendo la cuarta moneda más revaluada de la región,"Durante el día, el tipo de cambio se movió en un rango amplio, entre un máximo de $4.032 y un mínimo de $3.985,10",,2025-07-03,https://www.larepublica.co/finanzas/el-peso-colombiano-continua-siendo-la-cuarta-moneda-mas-revaluada-de-la-region-4171073,0.0,neutral
"Expocafé y Grupo UMA, las empresas que lideran en ingresos del grupo de 601 a 700",Varias empresas dentro del grupo registraron utilidades netas positivas. Generarco reportó $55.518 millones y Premex alcanzó $15.194 millones,,2025-07-03,https://www.larepublica.co/especiales/las-mil-empresas-mas-grandes-de-2024/las-mil-empresas-mas-grandes-bloque-601a700-4170641,0.0,neutral
Renunció la canciller Laura Sarabia,"<p>Laura Sarabia dejó su cargo como ministra de Relaciones Exteriores alegando profundas diferencias con decisiones recientes del Gobierno. Su salida se suma a la polémica por el contrato de pasaportes.</p>
<p>El cargo <a href=""https://cronicadelquindio.com/actualidad/colombia/renuncio-la-canciller-laura-sarabia/"">Renunció la canciller Laura Sarabia</a> apareció primero en <a href=""https://cronicadelquindio.com"">Crónica del Quindio</a>.</p>",EFE Servicios,2025-07-03,https://cronicadelquindio.com/actualidad/colombia/renuncio-la-canciller-laura-sarabia/,0.0,neutral
Luto en el fútbol por muerte de Diogo Jota,"<p>Los hermanos portugueses, ambos futbolistas, fallecieron en un trágico accidente de tránsito en España. Autoridades investigan las causas del siniestro vial ocurrido en plena madrugada.</p>
<p>El cargo <a href=""https://cronicadelquindio.com/actualidad/mundo/luto-en-el-futbol-por-muerte-de-diogo-jota/"">Luto en el fútbol por muerte de Diogo Jota</a> apareció primero en <a href=""https://cronicadelquindio.com"">Crónica del Quindio</a>.</p>",EFE Servicios,2025-07-03,https://cronicadelquindio.com/actualidad/mundo/luto-en-el-futbol-por-muerte-de-diogo-jota/,0.0,neutral
"Deporte, motor de transformación social","<p>Desde el primer día de nuestro gobierno, asumí el compromiso de convertir a Armenia en una ciudad donde el deporte no sea solo actividad física, sino una herramienta real de transformación social, de construcción de tejido comunitario y de oportunidades para nuestros niños, niñas, jóvenes y adultos.</p>
<p>El cargo <a href=""https://cronicadelquindio.com/opinion/columnistas/deporte-motor-de-transformacion-social/"">Deporte, motor de transformación social</a> apareció primero en <a href=""https://cronicadelquindio.com"">Crónica del Quindio</a>.</p>",James Padilla García,2025-07-03,https://cronicadelquindio.com/opinion/columnistas/deporte-motor-de-transformacion-social/,-0.296,negative
"Sin previa socialización, Área Limpia activa servicios en tres municipios del Quindío","<p>Aunque su llegada está respaldada por la ley, la empresa inició actividades en La Tebaida, Circasia y Quimbaya sin que los alcaldes tuvieran conocimiento previo. La situación genera dudas sobre la forma en que se implementará el servicio, especialmente en lugares donde ya existen empresas para atender la necesidad.</p>
<p>El cargo <a href=""https://cronicadelquindio.com/quindio/sin-previa-socializacion-area-limpia-activa-servicios-en-tres-municipios-del-quindio/"">Sin previa socialización, Área Limpia activa servicios en tres municipios del Quindío</a> apareció primero en <a href=""https://cronicadelquindio.com"">Crónica del Quindio</a>.</p>",Camilo Jose Zamora,2025-07-03,https://cronicadelquindio.com/quindio/sin-previa-socializacion-area-limpia-activa-servicios-en-tres-municipios-del-quindio/,-0.5574,negative
Nada más fácil,"<p>Con este título, Antonio Muñoz Molina, escritor y columnista español, escribió un artículo en El País de Madrid, que deberíamos reproducir todos.</p>
<p>El cargo <a href=""https://cronicadelquindio.com/opinion/columnistas/nada-mas-facil/"">Nada más fácil</a> apareció primero en <a href=""https://cronicadelquindio.com"">Crónica del Quindio</a>.</p>",Óscar Iván Sabogal V.,2025-07-03,https://cronicadelquindio.com/opinion/columnistas/nada-mas-facil/,0.0,neutral
