titulo,resumen,autor,fecha,url
Cox gana un contrato en Paraguay para construir 500 km de líneas de transmisión,"Con una experiencia global que supera los 30.000 kilómetros de líneas de transmisión, Cox consolida su liderazgo regional en Latinoamérica",,"Tue, 01 Jul 2025 12:22:40 +0000",https://www.larepublica.co/globoeconomia/cox-gana-un-contrato-en-paraguay-para-construir-500-km-de-lineas-de-transmision-4169176
Peruana Credicorp inicia acciones legales en contra de la administración tributaria,"Al respecto, el CEO de Credicorp, Gianfranco Ferrari, criticó a través de su cuenta en LinkedIn la acción de la Sunat",,"Tue, 01 Jul 2025 12:17:17 +0000",https://www.larepublica.co/globoeconomia/peruana-credicorp-inicia-acciones-legales-en-contra-de-la-administracion-tributaria-4169169
Empresa Metro de Bogotá dijo que la estación Hospital va a dejar de operar en el sistema,"Para mayor información sobre las modificaciones en paraderos de estación y rutas, la compañía enfatizó que está disponible TransMiApp",,"Tue, 01 Jul 2025 12:11:58 +0000",https://www.larepublica.co/economia/la-empresa-metro-de-bogota-anuncio-que-la-estacion-hospital-dejara-de-operar-4169167
"Contraloría reportó hallazgos con incidencia fiscal por $1,17 billones al cierre de junio",El órgano de control detalló que el sector vivienda fue el que presentó mayores hallazgos fiscales por $593.000 millones,,"Tue, 01 Jul 2025 12:03:24 +0000",https://www.larepublica.co/economia/contraloria-reporto-hallazgos-con-incidencia-fiscal-por-1-17-billones-al-cierre-de-junio-4169162
Este es el ranking de líneas navieras con los mayores ingresos en lo corrido de 2025,"Al corte del primer trimestre de 2025, las líneas navieras muestran dos situaciones: cifras financieras sólidas, con mejoras operativas relevantes",,"Tue, 01 Jul 2025 12:02:43 +0000",https://www.larepublica.co/empresas/este-es-el-ranking-de-lineas-navieras-con-los-mayores-ingresos-en-lo-corrido-de-2025-4169135
"Senado de EE.UU. prolonga votación del proyecto de ley de Trump de US$3,3 billones","No estaba claro cuánto tiempo duraría la votación, que comenzó a primera hora del lunes y se extendió unas 18 horas",,"Tue, 01 Jul 2025 12:02:04 +0000",https://www.larepublica.co/globoeconomia/senado-de-ee-uu-prolonga-votacion-del-proyecto-de-ley-de-trump-de-us-3-3-billones-4169159
Vía a Villavicencio sufre cierres temporales y preventivos por caída de lodo y árboles,"Limpieza se da en el kilómetro 64+640, 68+800 y 62+300 en sentido Bogotá-Villavicencio y kilómetro 74+400 Villavicencio-Bogotá",,"Tue, 01 Jul 2025 11:45:48 +0000",https://www.larepublica.co/economia/via-a-villavicencio-sufre-cierres-temporales-y-preventivos-por-caida-de-lodo-y-arboles-4169141
Las ventas de vehículos nuevos de Tesla en España repuntaron más de 60% en junio,"En el primer semestre del año, sin embargo, las ventas de coches Tesla en España cayeron un 0,9% respecto al mismo periodo del año anterior",,"Tue, 01 Jul 2025 11:45:15 +0000",https://www.larepublica.co/globoeconomia/las-ventas-de-vehiculos-nuevos-de-tesla-en-espana-repuntaron-mas-de-60-en-junio-4169145
Gobierno anunció el inicio del montaje de un puente sobre el río Negro en Putumayo,"La estructura fue trasladada desde bodegas ubicadas en Fontibón, Bogotá. Se espera que, en una semana, se habilite el paso vehicular",,"Tue, 01 Jul 2025 11:38:19 +0000",https://www.larepublica.co/economia/gobierno-anuncio-el-inicio-del-montaje-de-un-puente-sobre-el-rio-negro-en-putumayo-4169142
Francia cierra colegios por la ola de calor y el mar en España alcanza temperaturas récord,"Europa es el continente que más rápido se calienta del mundo, el doble que la media mundial, según el Servicio de Cambio Climático",,"Tue, 01 Jul 2025 11:34:45 +0000",https://www.larepublica.co/globoeconomia/francia-cierra-colegios-por-la-ola-de-calor-y-el-mar-en-espana-alcanza-temperaturas-record-4169140
El oro sube sobre US$3.340 ante la debilidad del dólar e incertidumbre arancelaria,"El índice del dólar estadounidense .DXY caía 0,2% a mínimos de más de tres años, lo que hace que el lingote sea más accesible",,"Tue, 01 Jul 2025 11:18:34 +0000",https://www.larepublica.co/finanzas/precio-del-oro-hoy-1-de-julio-de-2025-4169133
Este Gobierno los está matando,"La enfermedad de Gaucher es un trastorno que afecta al hígado, el bazo, la médula ósea y, en algunos casos, al sistema nervioso central",,"Tue, 01 Jul 2025 05:05:10 +0000",https://www.larepublica.co/analisis/diego-gomez-3234242/este-gobierno-los-esta-matando-4168123
"Garmin, Polar y Coros, entre las marcas de relojes ideales para correr la Media Maratón","Para medir sus entrenamientos o carreras podrá encontrar relojes que van desde $601.641 hasta $4,39 millones, como el Apple Watch Ultra",,"Tue, 01 Jul 2025 05:03:50 +0000",https://www.larepublica.co/ocio/garmin-polar-y-coros-entre-las-marcas-de-relojes-ideales-para-correr-la-media-maraton-4168089
Navegando transformaciones organizacionales en tiempos inciertos,En Kearney tenemos el privilegio de acompañar las transformaciones de algunas de las compañías más grandes del mundo,,"Tue, 01 Jul 2025 05:03:39 +0000",https://www.larepublica.co/analisis/eulalia-sanin-gomez-4168145/navegando-transformaciones-organizacionales-en-tiempos-inciertos-4168142
"El lanzamiento en Bogotá de Pixie Science, una apuesta de soluciones nutricionales","Se llevó a cabo un importante encuentro en Bogotá para agradecer a proveedores, veterinarios, puntos de venta y aliados estratégicos",,"Tue, 01 Jul 2025 05:02:05 +0000",https://www.larepublica.co/ocio/el-lanzamiento-en-bogota-de-pixie-science-una-apuesta-de-soluciones-nutricionales-4168066
"Obras, los aranceles de Donald Trump y las polémicas marcan el inicio del Mundial 2026","El monto de adecuaciones en Toronto y Vancouver podría superar US$380 millones, financiados con recursos federales y estatales",,"Tue, 01 Jul 2025 05:01:58 +0000",https://www.larepublica.co/globoeconomia/obras-los-aranceles-de-donald-trump-y-las-polemicas-marcan-inicio-del-mundial-2026-4168372
Misericordia con crueldad,"Pero ¿en qué país un criminal condenado toma el micrófono en una plaza pública, al lado del jefe de Estado, para atacar a las autoridades elegidas democráticamente y no pasa absolutamente nada?",,"Tue, 01 Jul 2025 05:01:54 +0000",https://www.larepublica.co/analisis/maria-claudia-lacouture-402341/misericordia-con-crueldad-4168042
"“Este año esperamos entregar alrededor de 820 aviones, 7% más respecto al total de 2024”","Arturo Barreira, presidente de Airbus en América Latina y el Caribe, destacó que hasta mayo han entregado 243 aviones y esperan superar la cifra de 766 unidades en 2024",,"Tue, 01 Jul 2025 05:01:53 +0000",https://www.larepublica.co/empresas/este-ano-esperamos-entregar-alrededor-de-820-aviones-7-mas-respecto-a-2024-4168283
No rotundo a la constituyente petrista,"Ha indicado que es posible hacerlo por una vía para-constitucional, mediante una “octava papeleta” que sería una ley de la República, si se obtiene el respaldo del 20% del censo electoral",,"Tue, 01 Jul 2025 05:01:49 +0000",https://www.larepublica.co/analisis/juan-pablo-lievano-vegalara-2858000/no-rotundo-a-la-constituyente-petrista-4168054
Tasas de fumadores,,,"Tue, 01 Jul 2025 05:01:48 +0000",https://www.larepublica.co/caja-fuerte/tasas-de-fumadores-4168587
Mercado de productos para la protección solar llegará a US$20.920 millones en 2031,"Las principales firmas del sector incluyen compañías como L'Oréal Paris, Estée Lauder Companies, y Johnson & Johnson Services",,"Tue, 01 Jul 2025 05:01:45 +0000",https://www.larepublica.co/consumo/el-mercado-de-productos-para-la-proteccion-solar-llegara-a-us-20-920-millones-en-2031-4168743
Los candidatos ya deben hacer sus propuestas,"A poco más de un mes y un año para que el Gobierno actual entregue la administración del país, los aspirantes a ser presidentes tienen que empezar a hacer propuestas serias",,"Tue, 01 Jul 2025 05:01:43 +0000",https://www.larepublica.co/opinion/editorial/los-candidatos-ya-deben-hacer-sus-propuestas-4167225
"La fuerza de la industria del anime en plataformas streaming genera US$31,6 millones","Según el estudio, solo Netflix concentra 38% de los ingresos internacionales del anime, lo que refleja un intercambio comercial más sólido",,"Tue, 01 Jul 2025 05:01:40 +0000",https://www.larepublica.co/consumo/la-fuerza-de-la-industria-del-anime-en-plataformas-streaming-genera-us-31-6-millones-4168758
"Entendamos… con delincuentes, todo es a la brava",El progresismo nos llevó a una depreciación de los principios éticos y los valores y libertades democráticas que ceden terreno a gobiernos autocráticos donde todo se negocia,,"Tue, 01 Jul 2025 05:01:34 +0000",https://www.larepublica.co/analisis/luis-guillermo-echeverri-velez-3075852/entendamos-con-delincuentes-todo-es-a-la-brava-4168117
CCI dijo que vigencias futuras deben preservarse como una fuente de financiación,"Juan Martín Caicedo, presidente de la CCI,  señaló que la inversión del programa 4G asciende a $59,68 billones en capex y $61,32 billones en opex",,"Tue, 01 Jul 2025 05:01:27 +0000",https://www.larepublica.co/economia/cci-dijo-que-las-vigencias-futuras-deben-preservarse-como-fuente-de-financiacion-de-proyectos-4g-y-5g-4168898
"La Harinera del Valle, Bimbo y Levapan son los reyes de la industria de la panadería","La mitad de los productos a base de harina de trigo en Colombia son los panes, con más de 50%. Del total de la industria, $12,6 billones se destinan al año a comprar panes",,"Tue, 01 Jul 2025 05:01:26 +0000",https://www.larepublica.co/empresas/la-harinera-del-valle-bimbo-y-levapan-son-los-reyes-de-la-industria-de-la-panaderia-4167234
"Más de 1,25 millones de cabezas de ganado se están sacrificando en medio de la clandestinidad","Gremios alertaron que estas prácticas ponen en riesgo la salud pública, y que las enfermedades digestivas e aumentaron desde el cierre de mataderos en 2007",,"Tue, 01 Jul 2025 05:01:25 +0000",https://www.larepublica.co/economia/mas-de-1-25-millones-de-cabezas-de-ganado-se-estan-sacrificando-en-la-clandestinidad-4168092
"Las bodas e ir a la playa, esta es la oferta extraordinaria que le apuestan centros comerciales",Varios centros comerciales ofrecen actividades especiales para llamar la atención de los colombianos y que decidan pasar las tardes en sus establecimientos,,"Tue, 01 Jul 2025 05:01:18 +0000",https://www.larepublica.co/empresas/bodas-y-playa-la-oferta-extraordinaria-de-los-centros-comerciales-4167231
Así comienzan los principales indicadores macroeconómicos para el segundo semestre,"La inflación inicia cerca de 5%, el desempleo se mantiene en un dígito, el precio del petróleo continuó con altas fluctuaciones y el PIB podría crecer por encima de 2,5% en 2025",,"Tue, 01 Jul 2025 05:01:16 +0000",https://www.larepublica.co/economia/asi-comienzan-los-principales-indicadores-macroeconomicos-en-el-segundo-semestre-4168736
IA: Código sin humanos,"Este cambio no implica necesariamente la desaparición de la carrera informática o la ingeniería de sistemas, sino su transformación radical",,"Tue, 01 Jul 2025 05:01:15 +0000",https://www.larepublica.co/analisis/javier-villamizar-500031/ia-codigo-sin-humanos-4168132
Inflación y desaceleración económica: desafiando a bancos centrales,"De una parte, se reducen las perspectivas de crecimiento, pasando del 2.3% hacia 1.3% en 2025, y, de otra, se eleva el pronóstico de inflación del 2.3% hacia el 3% anual, antes señalado",,"Tue, 01 Jul 2025 05:01:12 +0000",https://www.larepublica.co/analisis/sergio-clavijo-500041/inflacion-y-desaceleracion-economica-desafiando-a-bancos-centrales-4168045
"Estos son los países que lideran en producción de uranio, clave en conflicto entre Israel e Irán","Kazajistán, Canadá, Namibia y Australia concentran dos tercios de la producción mundial; el mineral sirve para fabricar ojivas",,"Tue, 01 Jul 2025 05:01:06 +0000",https://www.larepublica.co/globoeconomia/paises-que-lideran-en-la-produccion-de-uranio-4168368
El DNP y MinAgricultura presentan iniciativa para mejorar la logística agrícola,"El subdirector de regalías del DNP, Jhonattan Duque dijo que el uso de estas iniciativas permite un ahorro significativo en costos",,"Tue, 01 Jul 2025 05:01:06 +0000",https://www.larepublica.co/economia/dnp-y-minagricultura-lanzaron-el-nuevo-proyecto-infraestructura-logistica-agricola-4168943
Diversidad cultural: hablar el mismo lenguaje,Ignorar las diferencias culturales puede llevar a: fricciones innecesarias por malos entendidos; desmotivación de talentos extranjeros que no se sienten incluidos; y pérdida de productividad por problemas de comunicación,,"Tue, 01 Jul 2025 05:01:05 +0000",https://www.larepublica.co/analisis/pilar-ibanez-514336/diversidad-cultural-hablar-el-mismo-lenguaje-4168061
"“Tenemos presupuestado poder llegar a México, Chile y Perú durante lo que resta de 2025”","iUvity, en cabeza de Angelo Cirillo, le apuesta al Open Finance y al antifraude, con más de 15.000 millones de movimientos al año y  esperan expandirse a nuevos países de latam",,"Tue, 01 Jul 2025 05:01:03 +0000",https://www.larepublica.co/finanzas/tenemos-presupuestado-llegar-a-mexico-chile-y-peru-durante-lo-que-resta-de-2025-4167948
"Abrir los datos, cerrar las brechas","El proyecto acierta al reconocer esta premisa al comprometerse con la creación de estándares que garanticen que los datos sean útiles, actualizados, verificables y estandarizados",,"Tue, 01 Jul 2025 05:01:03 +0000",https://www.larepublica.co/analisis/jonathan-malagon-2590707/abrir-los-datos-cerrar-las-brechas-4168057
Los costos en los bares pueden subir hasta 25% con la entrada en vigor de la reforma laboral,Las razones del aumento en estos establecimientos se centra en la modificación de la jornada nocturna y el aumento del recargo por dominicales,,"Tue, 01 Jul 2025 05:01:01 +0000",https://www.larepublica.co/economia/los-costos-en-bares-pueden-subir-hasta-25-con-la-entrada-en-vigencia-de-la-laboral-4168725
El sector cooperativo parte con ventaja en el nuevo esquema de pagos inmediatos,"En Inside LR con Santiago Gallego, gerente de Visionamos, destacó que desde su creación como aglutinador realizan pagos interoperados",,"Tue, 01 Jul 2025 05:00:56 +0000",https://www.larepublica.co/finanzas/el-sector-cooperativo-parte-con-ventaja-en-el-nuevo-esquema-de-pagos-inmediatos-4168879
Recomendaciones clave para proteger sus llaves y evitar ser víctima de posibles delitos,Las recomendaciones de expertos y entidades bancarias manifiestan que para proteger su llave es que utilice siempre los canales oficiales,,"Tue, 01 Jul 2025 05:00:49 +0000",https://www.larepublica.co/finanzas/conozca-todo-lo-que-debe-saber-para-proteger-sus-llaves-ante-posibles-delitos-4168870
El rol de las fintech en el nuevo esquema de pagos digitales interoperables a nivel nacional,"Actualmente, de las 16 entidades que conforman el piloto de pagos con llaves de Redeban, siete pertenecen a esta categoría",,"Tue, 01 Jul 2025 05:00:17 +0000",https://www.larepublica.co/finanzas/el-rol-de-las-fintech-en-el-nuevo-esquema-de-pagos-digitales-con-llaves-del-pais-4168875
"De 16 entidades bancarias, ya hay 36 millones de llaves activas para realizar pagos inmediatos","El piloto de Redeban ya suma operaciones por más de $970.000 millones, de acuerdo al último reporte. El ticket promedio asciende hasta casi $227.000 por pago",,"Tue, 01 Jul 2025 05:00:07 +0000",https://www.larepublica.co/finanzas/de-16-entidades-bancarias-ya-hay-36-millones-de-llaves-activas-para-pagos-inmediatos-4168844
Al límite,,,"Tue, 01 Jul 2025 05:00:03 +0000",https://www.larepublica.co/analisis/lewis-acuna-3441162/al-limite-4168046
Caravana de hinchas de Santa Fe desató caos vehicular en Bogotá en el plan retorno,"En medio de la coyuntura, Avianca activó un plan de protección para los pasajeros que no lograron llegar a tiempo al aeropuerto",,"Mon, 30 Jun 2025 23:46:32 +0000",https://www.larepublica.co/economia/caravana-de-hinchas-de-santa-fe-desato-caos-vehicular-en-bogota-durante-el-plan-retorno-4169023
EE.UU. reanudará gradualmente importaciones de ganado mexicano tras suspensión,"El puerto de Douglas, Arizona, será el primero en reabrir a partir del 7 de julio, tras la suspensión de las importaciones de ganado vacuno, caballos y bisontes vivos",,"Mon, 30 Jun 2025 22:32:53 +0000",https://www.larepublica.co/globoeconomia/ee-uu-reanudara-gradualmente-importaciones-de-ganado-mexicano-tras-suspension-4169008
"Donald Trump recibirá al primer ministro israelí, Benjamin Netanyahu, en la Casa Blanca","Israel intensificó sus ataques contra el norte de Gaza el lunes, un día después de que Trump instara a poner fin a la guerra de 20 meses",,"Mon, 30 Jun 2025 21:56:38 +0000",https://www.larepublica.co/globoeconomia/donald-trump-recibira-al-primer-ministro-israeli-benjamin-netanyahu-en-la-casa-blanca-4168998
"Donald Trump amenazó con aranceles a Japón, Hassett afirmó que habrá acuerdos","Durante semanas, Trump ha buscado ejercer influencia sobre sus socios negociadores antes de la fecha límit",,"Mon, 30 Jun 2025 21:08:08 +0000",https://www.larepublica.co/globoeconomia/trump-amenaza-con-aranceles-a-japon-hassett-afirma-que-habra-acuerdos-despues-del-4-de-julio-4168992
Seis ciudades colombianas se encuentran en el top 10 con más trancones en hora pico,Cinco ciudades colombianas se ubican entre las diez con más congestión en Latinoamérica,,"Mon, 30 Jun 2025 20:29:20 +0000",https://www.larepublica.co/economia/seis-ciudades-colombianas-se-encuentran-en-el-top-10-con-mas-trancones-en-hora-pico-4168980
Petro solicita venta de tierras al Estado en zona entre Tolú Viejo y golfo de Morrosquillo,"De acuerdo con el “contador oficial” de tierras del Gobierno, ya se han adquirido 598.730 hectáreas mediante compras directas",,"Mon, 30 Jun 2025 20:19:24 +0000",https://www.larepublica.co/economia/petro-solicita-venta-de-tierras-al-estado-en-zona-entre-tolu-viejo-y-golfo-de-morrosquillo-4168959
"Yamandú Orsi advirtió que Uruguay ""no soporta"" vivir en una permanente campaña","Orsi afirmó que ya ""pasaron las elecciones"" y ""la ciudadanía decidió y hoy hay un partido político en el gobierno, y otro que hace oposición""",,"Mon, 30 Jun 2025 20:01:49 +0000",https://www.larepublica.co/globoeconomia/orsi-advierte-que-uruguay-no-soporta-vivir-en-permanente-campana-4168973
Nuevo CEO de Vale dice que la minera brasileña debería ser la más grande del mundo,"La capitalización bursátil de Vale es de US$43.900 millones, cerca de un tercio del valor de mercado de BHP y menos de la mitad del de Rio Tinto",,"Mon, 30 Jun 2025 19:46:20 +0000",https://www.larepublica.co/globoeconomia/el-nuevo-ceo-de-vale-dice-que-la-minera-brasilena-deberia-ser-la-mas-grande-del-mundo-4168970
Javier Milei sufre un revés legal en el caso YPF de Burford por US$16.000 millones,La jueza Loretta Preska dio al gobierno de Milei 14 días para entregar 51% de las acciones de la compañía a una cuenta de custodia global,,"Mon, 30 Jun 2025 19:37:52 +0000",https://www.larepublica.co/globoeconomia/javier-milei-sufre-un-reves-legal-en-el-caso-ypf-de-burford-por-us-16-000-millones-4168966
La Casa Blanca afirma que Trump pondrá fin al programa de sanciones contra Siria,"La orden mantendrá las sanciones contra Assad y sus asociados, así como contra los narcotraficantes y el Estado Islámico",,"Mon, 30 Jun 2025 18:55:31 +0000",https://www.larepublica.co/globoeconomia/la-casa-blanca-afirma-que-trump-pondra-fin-al-programa-de-sanciones-contra-siria-4168944
Ecuador recibirá inversión extranjera por US$1.000 millones para energía renovable,La inversión de la empresa china en proyectos de energía renovable y almacenamiento será progresiva hasta diciembre del 2026,,"Mon, 30 Jun 2025 18:28:04 +0000",https://www.larepublica.co/globoeconomia/ecuador-recibira-inversion-extranjera-por-us-1-000-millones-para-energia-renovable-4168933
Fedepalma rechazó los actos en La Tebaida donde está su empresa afiliada Palmeiras,También hicieron un llamado a las autoridades nacionales y locales para que se garantice la seguridad e integridad del equipo humano de la empresa,,"Mon, 30 Jun 2025 18:23:09 +0000",https://www.larepublica.co/economia/fedepalma-rechazo-los-actos-en-la-tebaida-donde-esta-su-empresa-afiliada-palmeiras-de-colombia-4168921
Unidad de minera mexicana Industrias Peñoles reanuda labores tras huelga sindical,Industrias Peñoles Peoles.mx dijo que el regreso a las actividades se dio tras la orden de un tribunal que declaró justificada la medida de protesta impulsada por el sindicato,,"Mon, 30 Jun 2025 18:12:12 +0000",https://www.larepublica.co/globoeconomia/unidad-de-minera-mexicana-industrias-penoles-reanuda-labores-tras-huelga-sindical-4168929
Departamento de Justicia de EE.UU. demandó a Los Ángeles por política migratoria,"""Las políticas de 'ciudad santuario' de Los Ángeles son ilegales bajo la ley federa"", dijo el DoJ en un comunicado",,"Mon, 30 Jun 2025 18:04:16 +0000",https://www.larepublica.co/globoeconomia/departamento-de-justicia-de-ee-uu-demando-a-los-angeles-por-politica-migratoria-4168926
Fitch alerta que la distensión arancelaria no evita el freno del crecimiento mundial,La actualización responde principalmente a la reciente desescalada en las tensiones arancelarias entre Estados Unidos y China,,"Mon, 30 Jun 2025 17:53:00 +0000",https://www.larepublica.co/globoeconomia/fitch-alerta-que-la-distension-arancelaria-no-evita-el-freno-del-crecimiento-mundial-4168919
"Ibex lidera bolsas mundiales en el semestre con alza de 20,67%, gracias a Indra y la banca","La renta variable europea ha cerrado hoy con suaves caídas, a excepción del Ibex y el Mib italiano, que con una revalorización de 16,40%",,"Mon, 30 Jun 2025 17:19:51 +0000",https://www.larepublica.co/globoeconomia/el-ibex-cierra-el-semestre-como-la-mejor-bolsa-del-mundo-4168897
Turquía y Francia sufren incendios en el comienzo de una ola de calor en la región,Las regiones costeras del país se han visto asoladas en los años recientes por incendios debido a que los veranos son cada vez más calurosos,,"Mon, 30 Jun 2025 17:03:31 +0000",https://www.larepublica.co/globoeconomia/turquia-y-francia-sufren-incendios-en-el-comienzo-de-una-ola-de-calor-en-la-region-4168877
Bbva mantiene OPA sobre Sabadell a pesar de las condiciones del Gobierno,"""Bbva ha decidido no desistir de la oferta, que se mantiene vigente conforme a lo previsto en la normativa aplicable"", señalaron desde Bbva",,"Mon, 30 Jun 2025 16:56:17 +0000",https://www.larepublica.co/globoeconomia/bbva-mantiene-la-opa-sobre-sabadell-a-pesar-de-las-condiciones-del-gobierno-4168889
El poder político,"<p>Una obra que se apoya en un amplio soporte bibliográfico y documental y que examina con lujo de detalles un período importante y decisivo de nuestra historia (1), una investigación magistral, bien escrita, con fundamentos serios, estupendo trabajo de archivos y desde luego análisis exhaustivo de documentos de alto valor histórico: “ La forma como se repartió la tierra en el territorio que hoy es Colombia por parte de los españoles que lo conquistaron, marcó, de manera profunda, el ejercicio del poder social y político sobre las poblaciones que lo habitaban, no solo en esa época, sino también en los períodos colonial y republicano. Definió, además, la organización de la vida económica y social hasta entrado el siglo XX, y, por qué no, hasta el siglo XXI (…)”.</p>
<p>El cargo <a href=""https://cronicadelquindio.com/opinion/columnistas/el-poder-politico/"">El poder político</a> apareció primero en <a href=""https://cronicadelquindio.com"">Crónica del Quindio</a>.</p>",Gabriel Echeverri González,"Tue, 01 Jul 2025 05:00:55 +0000",https://cronicadelquindio.com/opinion/columnistas/el-poder-politico/
Inauguración escultura ‘Susurro del ocaso’ en el C.C Portal del Quindío,"<p>El pasado viernes 27 de junio, fue instalada la escultura ‘susurro del ocaso’ de la artista plástica y diseñadora Viviana Spinosa. Tal obra de arte fue creada como homenaje a la palma de cera y la importancia de conservar el medio ambiente. En la inauguración estuvo presente la artista y la gerente del centro comercial.</p>
<p>En la foto: Viviana Spinosa, diseñadora y artista plástica, acompañada de Claudia Arteta, gerente del centro comercial Portal del Quindío.</p>
<p>El cargo <a href=""https://cronicadelquindio.com/actualidad/novedades/sociales/inauguracion-escultura-susurro-del-ocaso-en-el-c-c-portal-del-quindio/"">Inauguración escultura ‘Susurro del ocaso’ en el C.C Portal del Quindío</a> apareció primero en <a href=""https://cronicadelquindio.com"">Crónica del Quindio</a>.</p>",socialmedia@cronicadelquindio.com,"Tue, 01 Jul 2025 05:00:52 +0000",https://cronicadelquindio.com/actualidad/novedades/sociales/inauguracion-escultura-susurro-del-ocaso-en-el-c-c-portal-del-quindio/
"Jorge Iván Rengifo Rodríguez, un mes en la gerencia de Mercar","<p>Pretende consolidar a Mercar como el principal centro de acopio del departamento, fortaleciendo la economía rural, la innovación y las alianzas estratégicas.</p>
<p>El cargo <a href=""https://cronicadelquindio.com/actualidad/economia/jorge-ivan-rengifo-rodriguez-un-mes-en-la-gerencia-de-mercar/"">Jorge Iván Rengifo Rodríguez, un mes en la gerencia de Mercar</a> apareció primero en <a href=""https://cronicadelquindio.com"">Crónica del Quindio</a>.</p>",Sara Samanta Arango,"Tue, 01 Jul 2025 05:00:48 +0000",https://cronicadelquindio.com/actualidad/economia/jorge-ivan-rengifo-rodriguez-un-mes-en-la-gerencia-de-mercar/
